{
  "id": "google/drive-api",
  "name": "Google Drive API",
  "publisher": {
    "name": "Google",
    "url": "https://developers.google.com/workspace/drive",
    "verified": true
  },
  "capabilities": [
    "file-management",
    "file-upload",
    "file-download",
    "permissions-sharing",
    "change-tracking"
  ],
  "description": "Google Drive REST API v3 for searching files, uploading and downloading content, managing permissions, and tracking changes across My Drive and shared drives.",
  "pricing": "Quota-limited shared infrastructure: 12,000 queries per 60 seconds per project and per user. Limits docs: https://developers.google.com/workspace/drive/api/guides/limits",
  "currency": "USD",
  "payment": {
    "is_paid": false,
    "purl_supported": false
  }
}
