{"id":"polymarket/cli","name":"Polymarket CLI","publisher":{"name":"Polymarket","url":"https://polymarket.com","verified":true},"capabilities":["markets","orderbook","cli"],"description":"Official Polymarket CLI for market/event discovery and order-book operations against Polymarket data.","pricing":"Open-source CLI hosted at https://github.com/Polymarket/polymarket-cli; API usage follows https://docs.polymarket.com","currency":"USD","payment":{"is_paid":false,"purl_supported":false}}
